,Product ID,Category,Sub-Category,Product Name,Unit Price
2959,OFF-BI-10003152,Office Supplies,Binders,"Avery Hole Reinforcements, Recycled",4.77
2960,OFF-AR-10001149,Office Supplies,Art,"Avery Hi-Liter Comfort Grip Fluorescent Highlighter, Yellow Ink",1.95
2961,OFF-AP-10000717,Office Supplies,Appliances,"Hoover Microwave, Black",308.07
2963,FUR-BO-10003028,Furniture,Bookcases,"Sauder 3-Shelf Cabinet, Mobile",169.2
2964,FUR-CH-10000602,Furniture,Chairs,"Novimex Executive Leather Armchair, Red",460.2
2966,FUR-BO-10000684,Furniture,Bookcases,"Sauder Corner Shelving, Traditional",147.3
2967,FUR-BAR-10003576,Furniture,Tables,"Barricks Training Table, with Bottom Storage",318.3
2968,OFF-PA-10000951,Office Supplies,Paper,"Enermax Note Cards, Multicolor",32.64
2969,FUR-FU-10002250,Furniture,Furnishings,"Advantus Photo Frame, Durable",50.01
2970,FUR-CH-10001708,Furniture,Chairs,Office Star - Contemporary Swivel Chair with Padded Adjustable Arms and Flex Back,140.98
2971,OFF-AR-10000502,Office Supplies,Art,"BIC Highlighters, Easy-Erase",19.2
2972,OFF-ST-10003858,Office Supplies,Storage,"Fellowes File Cart, Single Width",91.56
2974,OFF-PA-10001844,Office Supplies,Paper,"Eaton Message Books, 8.5 x 11",24.72
2977,OFF-PA-10002222,Office Supplies,Paper,"Xerox Color Copier Paper, 11"" x 17"", Ream",22.84
2978,OFF-AR-10002400,Office Supplies,Art,"Boston Highlighters, Water Color",22.05
2980,OFF-FA-10001551,Office Supplies,Fasteners,"Stockwell Thumb Tacks, 12 Pack",12.57
2982,OFF-BI-10002080,Office Supplies,Binders,"Acco Binder, Clear",9.74
2983,OFF-LA-10003327,Office Supplies,Labels,"Hon Legal Exhibit Labels, Adjustable",5.84
2984,OFF-LA-10000483,Office Supplies,Labels,"Harbour Creations Shipping Labels, Alphabetical",11.28
2986,OFF-BI-10000315,Office Supplies,Binders,Poly Designer Cover & Back,18.99
2987,OFF-LA-10002633,Office Supplies,Labels,"Novimex Shipping Labels, Laser Printer Compatible",10.98
2988,OFF-PA-10000019,Office Supplies,Paper,Xerox 1931,6.48
2989,OFF-PA-10004470,Office Supplies,Paper,"Adams Write n' Stick Phone Message Book, 11"" X 5 1/4"", 200 Messages",5.68
2990,OFF-LA-10002895,Office Supplies,Labels,"Avery Legal Exhibit Labels, Laser Printer Compatible",7.56
2991,FUR-CH-10004255,Furniture,Chairs,"SAFCO Executive Leather Armchair, Red",461.43
2992,OFF-ST-10003741,Office Supplies,Storage,"Smead Lockers, Blue",132.28
2993,FUR-BO-10002214,Furniture,Bookcases,"Dania Floating Shelf Set, Traditional",112.9
2995,TEC-CO-10001895,Technology,Copiers,"Sharp Wireless Fax, Color",357.36
2996,TEC-PH-10002755,Technology,Phones,"Apple Headset, VoIP",48.9
2997,OFF-AR-10003613,Office Supplies,Art,"Sanford Canvas, Easy-Erase",50.79
2998,FUR-TA-10001693,Furniture,Tables,"Bevis Training Table, with Bottom Storage",334.98
3000,FUR-FU-10001096,Furniture,Furnishings,"Advantus Clock, Black",51.39
3002,FUR-SAF-10003540,Furniture,Bookcases,"Safco Floating Shelf Set, Metal",196.2
3003,OFF-EN-10000128,Office Supplies,Envelopes,"GlobeWeis Interoffice Envelope, Set of 50",47.82
3004,OFF-ST-10003446,Office Supplies,Storage,"Smead Trays, Single Width",48.51
3005,FUR-FU-10000256,Furniture,Furnishings,"Rubbermaid Photo Frame, Duo Pack",51.81
3006,OFF-AP-10000569,Office Supplies,Appliances,"KitchenAid Coffee Grinder, Black",46.6
3008,FUR-FU-10000965,Furniture,Furnishings,"Howard Miller 11-1/2"" Diameter Ridgewood Wall Clock",51.94
3009,OFF-LA-10002733,Office Supplies,Labels,"Novimex File Folder Labels, Alphabetical",8.07
3010,OFF-BI-10001833,Office Supplies,Binders,"Ibico Hole Reinforcements, Recycled",7.35
3011,OFF-BI-10004334,Office Supplies,Binders,"Avery Hole Reinforcements, Durable",5.91
3012,OFF-LA-10004272,Office Supplies,Labels,Avery 482,2.89
3013,TEC-HEW-10000930,Technology,Copiers,"Hewlett Ink, Digital",148.32
3014,TEC-SAM-10000765,Technology,Phones,"Samsung Signal Booster, Full Size",137.88
3015,TEC-CO-10001040,Technology,Copiers,"Canon Personal Copier, Laser",95.16
3017,OFF-FIS-10000063,Office Supplies,Supplies,"Fiskars Box Cutter, Easy Grip",37.14
3018,OFF-ROG-10003993,Office Supplies,Storage,"Rogers File Cart, Single Width",141.63
3019,OFF-BI-10001659,Office Supplies,Binders,"Cardinal Index Tab, Clear",7.26
3020,FUR-ADV-10004718,Furniture,Furnishings,"Advantus Light Bulb, Duo Pack",20.13
3021,TEC-MOT-10003348,Technology,Phones,"Motorola Smart Phone, Full Size",642.69
3024,TEC-AC-10002455,Technology,Accessories,"Logitech Flash Drive, Programmable",32.01
3027,OFF-AP-10002578,Office Supplies,Appliances,"Fellowes Premier Superior Surge Suppressor, 10-Outlet, With Phone and Remote",48.92
3028,FUR-FU-10001617,Furniture,Furnishings,"Eldon Frame, Black",77.5
3031,OFF-AR-10004772,Office Supplies,Art,"Boston Highlighters, Fluorescent",13.42
3032,FUR-FU-10000885,Furniture,Furnishings,"Eldon Light Bulb, Durable",14.82
3033,OFF-SU-10003582,Office Supplies,Supplies,"Elite Scissors, High Speed",15.02
3034,OFF-AR-10002991,Office Supplies,Art,"Binney & Smith Markers, Blue",24.09
3035,OFF-JIF-10004450,Office Supplies,Envelopes,"Jiffy Mailers, Recycled",35.97
3036,TEC-PH-10004237,Technology,Phones,"Nokia Office Telephone, with Caller ID",43.42
3037,OFF-PA-10000213,Office Supplies,Paper,Xerox 198,4.98
3038,OFF-LA-10002319,Office Supplies,Labels,"Smead Legal Exhibit Labels, Laser Printer Compatible",11.1
3039,OFF-BI-10003503,Office Supplies,Binders,"Cardinal Index Tab, Economy",5.84
3040,OFF-FA-10001561,Office Supplies,Fasteners,Stockwell Push Pins,2.18
3041,OFF-AR-10001770,Office Supplies,Art,Economy #2 Pencils,2.66
3042,FUR-FU-10003981,Furniture,Furnishings,Eldon Wave Desk Accessories,2.08
3043,OFF-BI-10002062,Office Supplies,Binders,"Acco Hole Reinforcements, Economy",4.44
3045,TEC-PH-10001835,Technology,Phones,Jawbone JAMBOX Wireless Bluetooth Speaker,157.99
3047,OFF-ST-10004608,Office Supplies,Storage,"Smead Shelving, Industrial",49.41
3048,TEC-AC-10001874,Technology,Accessories,Logitech Wireless Anywhere Mouse MX for PC and Mac,59.99
3049,TEC-PH-10003927,Technology,Phones,"Cisco Signal Booster, Full Size",153.12
3051,TEC-AC-10003399,Technology,Accessories,Memorex Mini Travel Drive 64 GB USB 2.0 Flash Drive,36.24
3052,TEC-AC-10004586,Technology,Accessories,"Belkin Flash Drive, Bluetooth",41.94
3053,TEC-PH-10001575,Technology,Phones,"Samsung Office Telephone, VoIP",43.54
3054,OFF-ST-10000028,Office Supplies,Storage,"Rogers Shelving, Blue",41.42
3055,OFF-AR-10000719,Office Supplies,Art,"Boston Pencil Sharpener, Water Color",21.42
3056,TEC-PH-10000586,Technology,Phones,AT&T SB67148 SynJ,65.99
3058,OFF-ST-10000876,Office Supplies,Storage,Eldon Simplefile Box Office,12.44
3059,OFF-BOS-10002073,Office Supplies,Art,"Boston Canvas, Water Color",56.82
3060,OFF-PA-10000029,Office Supplies,Paper,Xerox 224,6.48
3061,OFF-LA-10000508,Office Supplies,Labels,"Harbour Creations Round Labels, 5000 Label Set",7.14
3062,OFF-FA-10001332,Office Supplies,Fasteners,"Acco Banker's Clasps, 5 3/4""-Long",2.88
3068,FUR-BO-10004529,Furniture,Bookcases,"Sauder 3-Shelf Cabinet, Pine",168.03
3069,OFF-PA-10004145,Office Supplies,Paper,"Xerox Message Books, 8.5 x 11",24.51
3070,OFF-BI-10002026,Office Supplies,Binders,Avery Arch Ring Binders,58.1
3071,FUR-BO-10001387,Furniture,Bookcases,"Safco Floating Shelf Set, Traditional",196.74
3072,TEC-PH-10002597,Technology,Phones,Xblue XB-1670-86 X16 Small†Office Telephone†- Titanium,125.99
3073,OFF-ST-10001562,Office Supplies,Storage,"Fellowes Box, Industrial",20.16
3074,TEC-AC-10001013,Technology,Accessories,Logitech ClearChat Comfort/USB Headset H390,29.29
3075,OFF-FA-10001435,Office Supplies,Fasteners,"Advantus Rubber Bands, Metal",11.14
3076,OFF-SU-10001886,Office Supplies,Supplies,"Acme Box Cutter, Serrated",34.5
3077,OFF-FA-10002506,Office Supplies,Fasteners,"OIC Rubber Bands, 12 Pack",16.5
3078,OFF-AR-10001813,Office Supplies,Art,"Stanley Markers, Fluorescent",15.64
3079,OFF-AP-10003177,Office Supplies,Appliances,"Hamilton Beach Toaster, White",55.65
3080,TEC-AC-10001465,Technology,Accessories,SanDisk Cruzer 64 GB USB Flash Drive,36.32
3083,FUR-FU-10000723,Furniture,Furnishings,"Deflect-o EconoMat Studded, No Bevel Mat for Low Pile Carpeting",41.32
3084,OFF-LA-10001299,Office Supplies,Labels,"Avery File Folder Labels, Adjustable",7.02
3087,OFF-AP-10004113,Office Supplies,Appliances,"Cuisinart Toaster, White",34.4
3088,OFF-JIF-10004822,Office Supplies,Envelopes,"Jiffy Mailers, Security-Tint",39.57
3090,FUR-FU-10004888,Furniture,Furnishings,"Tenex Stacking Tray, Erganomic",14.84
3091,FUR-CH-10002555,Furniture,Chairs,"Novimex Rocking Chair, Black",86.0
3093,OFF-FA-10003659,Office Supplies,Fasteners,"Accos Paper Clips, Assorted Sizes",7.66
3097,FUR-ADV-10001659,Furniture,Furnishings,"Advantus Light Bulb, Durable",17.1
3098,TEC-PH-10000895,Technology,Phones,Polycom VVX 310 VoIP phone,179.99
3100,FUR-CH-10001871,Furniture,Chairs,"Harbour Creations Steel Folding Chair, Set of Two",100.14
3102,FUR-CH-10003379,Furniture,Chairs,Global Commerce Series High-Back Swivel/Tilt Chairs,284.98
3104,TEC-PH-10004912,Technology,Phones,Cisco SPA112 2 Port Phone Adapter,54.95
3106,OFF-ROG-10003898,Office Supplies,Storage,"Rogers Lockers, Single Width",211.65
3107,TEC-PH-10003885,Technology,Phones,Cisco SPA508G,65.99
3109,TEC-CO-10004468,Technology,Copiers,"Canon Copy Machine, Digital",174.52
3111,TEC-PH-10000297,Technology,Phones,"Apple Office Telephone, with Caller ID",65.28
3114,OFF-EN-10003463,Office Supplies,Envelopes,"Jiffy Peel and Seal, Recycled",18.81
3115,OFF-PA-10001970,Office Supplies,Paper,Xerox 1881,12.28
3116,OFF-PA-10000552,Office Supplies,Paper,Xerox 200,6.48
3117,OFF-BI-10002954,Office Supplies,Binders,Newell 3-Hole Punched Plastic Slotted Magazine Holders for Binders,4.57
3119,OFF-LA-10001701,Office Supplies,Labels,"Novimex File Folder Labels, Adjustable",4.1
3120,TEC-HEW-10003829,Technology,Copiers,"Hewlett Wireless Fax, High-Speed",378.39
3121,TEC-CO-10000794,Technology,Copiers,"Hewlett Wireless Fax, High-Speed",378.39
3122,OFF-AR-10003066,Office Supplies,Art,"Sanford Markers, Water Color",26.43
3123,OFF-BI-10000341,Office Supplies,Binders,"Ibico Binding Machine, Recycled",51.78
3124,TEC-APP-10003588,Technology,Phones,"Apple Signal Booster, with Caller ID",136.65
3126,OFF-ST-10004459,Office Supplies,Storage,Tennsco Single-Tier Lockers,375.34
3127,FUR-CH-10002224,Furniture,Chairs,"Hon Rocking Chair, Set of Two",132.87
3128,TEC-PH-10000990,Technology,Phones,"Cisco Signal Booster, with Caller ID",101.22
3129,FUR-CH-10002940,Furniture,Chairs,"Harbour Creations Chairmat, Black",69.57
3130,OFF-AR-10000799,Office Supplies,Art,"Sanford Highlighters, Easy-Erase",16.02
3131,OFF-PA-10004498,Office Supplies,Paper,"Enermax Memo Slips, Multicolor",17.07
3132,OFF-BOS-10002558,Office Supplies,Art,"Boston Pencil Sharpener, Easy-Erase",30.21
3134,TEC-MA-10000776,Technology,Machines,"Okidata Calculator, Wireless",52.29
3136,TEC-AC-10001055,Technology,Accessories,"Enermax Numeric Keypad, Bluetooth",38.22
3137,OFF-SU-10004814,Office Supplies,Supplies,"Fiskars Shears, High Speed",47.64
3141,OFF-ST-10003956,Office Supplies,Storage,"Rogers Trays, Single Width",61.71
3143,OFF-HON-10000934,Office Supplies,Labels,"Hon Legal Exhibit Labels, Laser Printer Compatible",10.86
3145,OFF-BOS-10001348,Office Supplies,Art,"Boston Pencil Sharpener, Water Color",32.13
3148,OFF-BI-10001253,Office Supplies,Binders,"Acco Binder Covers, Recycled",13.68
3149,TEC-MA-10003326,Technology,Machines,"StarTech Calculator, Durable",40.08
3152,OFF-FA-10004854,Office Supplies,Fasteners,"Vinyl Coated Wire Paper Clips in Organizer Box, 800/Box",11.48
3153,OFF-AR-10003903,Office Supplies,Art,Sanford 52201 APSCO Electric Pencil Sharpener,40.97
3154,OFF-EN-10003559,Office Supplies,Envelopes,"Jiffy Clasp Envelope, with clear poly window",8.04
3156,FUR-FU-10003691,Furniture,Furnishings,"Eldon Image Series Desk Accessories, Ebony",12.35
3159,OFF-LA-10004114,Office Supplies,Labels,"Avery File Folder Labels, Alphabetical",8.94
3160,TEC-CO-10002658,Technology,Copiers,"Hewlett Ink, Laser",148.68
3163,OFF-ELD-10002207,Office Supplies,Storage,"Eldon Folders, Single Width",17.01
3164,OFF-STI-10004202,Office Supplies,Supplies,"Stiletto Scissors, Steel",23.01
3165,FUR-FU-10004006,Furniture,Furnishings,"Deflect-o DuraMat Lighweight, Studded, Beveled Mat for Low Pile Carpeting",42.65
3168,FUR-CH-10000229,Furniture,Chairs,Global Enterprise Series Seating High-Back Swivel/Tilt Chairs,270.98
3169,TEC-AC-10002942,Technology,Accessories,WD My Passport Ultra 1TB Portable External Hard Drive,69.0
3170,TEC-AC-10003857,Technology,Accessories,"Memorex Keyboard, Programmable",48.56
3171,OFF-EN-10002230,Office Supplies,Envelopes,Airmail Envelopes,83.93
3172,OFF-ST-10003816,Office Supplies,Storage,Fellowes High-Stak Drawer Files,176.19
3174,OFF-ST-10002352,Office Supplies,Storage,Iris Project Case,7.98
3175,OFF-BI-10000325,Office Supplies,Binders,"Wilson Jones Binder Covers, Recycled",7.7
3176,FUR-FU-10001196,Furniture,Furnishings,DAX Cubicle Frames - 8x10,5.77
3177,OFF-LA-10003591,Office Supplies,Labels,"Smead Removable Labels, Laser Printer Compatible",10.32
3178,OFF-ELI-10000711,Office Supplies,Supplies,"Elite Scissors, Serrated",19.23
3179,OFF-FA-10000581,Office Supplies,Fasteners,"Stockwell Thumb Tacks, Metal",13.65
3181,OFF-KLE-10002118,Office Supplies,Supplies,"Kleencut Ruler, Serrated",10.26
3182,OFF-BI-10002289,Office Supplies,Binders,"Ibico Binder, Economy",15.48
3184,OFF-ACC-10004364,Office Supplies,Fasteners,"Accos Push Pins, Bulk Pack",14.52
3186,FUR-FU-10002107,Furniture,Furnishings,Eldon Pizzaz Desk Accessories,2.23
3189,TEC-PH-10004057,Technology,Phones,"Motorola Smart Phone, with Caller ID",430.36
3190,FUR-CH-10003861,Furniture,Chairs,"Novimex Rocking Chair, Set of Two",133.68
3191,OFF-ST-10001638,Office Supplies,Storage,"Tenex File Cart, Single Width",134.61
3192,TEC-AC-10001348,Technology,Accessories,"Logitech Router, Bluetooth",247.32
3193,TEC-CO-10001787,Technology,Copiers,"HP Fax and Copier, Laser",172.89
3194,OFF-BI-10003527,Office Supplies,Binders,Fellowes PB500 Electric Punch Plastic Comb Binding Machine with Manual Bind,1270.99
3195,TEC-CO-10001087,Technology,Copiers,"Hewlett Ink, Laser",99.12
3199,OFF-ST-10004186,Office Supplies,Storage,"Stur-D-Stor Shelving, Vertical 5-Shelf: 72""H x 36""W x 18 1/2""D",110.98
3200,FUR-CH-10000665,Furniture,Chairs,"Global Airflow Leather Mesh Back Chair, Black",150.98
3201,FUR-BO-10002545,Furniture,Bookcases,"Atlantic Metals Mobile 3-Shelf Bookcases, Custom Colors",260.98
3202,TEC-MA-10000240,Technology,Machines,"Okidata Inkjet, Wireless",209.4
3205,TEC-CO-10001501,Technology,Copiers,"Canon Fax and Copier, Laser",191.34
3206,OFF-PA-10004039,Office Supplies,Paper,Xerox 1882,55.98
3207,OFF-PA-10003625,Office Supplies,Paper,Xerox 1979,30.98
3208,TEC-PH-10000560,Technology,Phones,Samsung Galaxy S III - 16GB - pebble blue (T-Mobile),349.99
3209,FUR-BO-10002250,Furniture,Bookcases,"Dania Floating Shelf Set, Mobile",114.58
3210,TEC-PH-10004959,Technology,Phones,Classic Ivory Antique†Telephone†ZL1810,100.49
3211,OFF-EN-10003537,Office Supplies,Envelopes,"GlobeWeis Manila Envelope, Set of 50",27.39
3212,TEC-CO-10001580,Technology,Copiers,"HP Ink, Digital",85.56
3213,FUR-TEN-10002448,Furniture,Furnishings,"Tenex Stacking Tray, Erganomic",22.26
3214,TEC-AC-10000335,Technology,Accessories,"Belkin Router, Programmable",173.5
3215,FUR-CH-10000988,Furniture,Chairs,Hon Olson Stacker Stools,140.81
3216,OFF-HON-10000172,Office Supplies,Labels,"Hon File Folder Labels, Alphabetical",8.46
3217,OFF-BI-10001895,Office Supplies,Binders,"Ibico Binding Machine, Economy",34.28
3219,TEC-PH-10003505,Technology,Phones,Geemarc AmpliPOWER60,92.8
3220,OFF-ST-10002176,Office Supplies,Storage,"Smead File Cart, Single Width",85.62
3222,TEC-CO-10002493,Technology,Copiers,"Hewlett Personal Copier, Color",97.14
3223,OFF-EN-10001315,Office Supplies,Envelopes,"Jiffy Manila Envelope, Security-Tint",28.41
3224,OFF-BI-10004969,Office Supplies,Binders,"Acco Binding Machine, Durable",35.06
3227,OFF-AR-10003582,Office Supplies,Art,"Boston Electric Pencil Sharpener, Model 1818, Charcoal Black",28.15
3228,OFF-LA-10001731,Office Supplies,Labels,"Avery Removable Labels, Alphabetical",10.56
3229,OFF-BOS-10000577,Office Supplies,Art,"Boston Highlighters, Blue",18.87
3230,OFF-AR-10003156,Office Supplies,Art,50 Colored Long Pencils,10.16
3231,OFF-PA-10001776,Office Supplies,Paper,"Wirebound Message Books, Four 2 3/4"" x 5"" Forms per Page, 600 Sets per Book",9.27
3232,OFF-FEL-10002837,Office Supplies,Storage,"Fellowes Folders, Single Width",26.43
3233,OFF-SU-10000979,Office Supplies,Supplies,"Acme Letter Opener, Easy Grip",21.22
3235,FUR-FU-10000409,Furniture,Furnishings,"GE 4 Foot Flourescent Tube, 40 Watt",14.98
3236,OFF-ADV-10003030,Office Supplies,Fasteners,"Advantus Staples, 12 Pack",10.29
3239,OFF-FA-10000563,Office Supplies,Fasteners,"Accos Push Pins, Assorted Sizes",7.98
3240,OFF-PA-10003724,Office Supplies,Paper,"Wirebound Message Book, 4 per Page",5.43
3241,FUR-FU-10000175,Furniture,Furnishings,DAX Wood Document Frame.,13.73
3243,OFF-BI-10003585,Office Supplies,Binders,"Acco 3-Hole Punch, Clear",19.72
3244,OFF-SU-10001574,Office Supplies,Supplies,Acme Value Line Scissors,3.65
3245,OFF-AR-10002096,Office Supplies,Art,"Binney & Smith Markers, Fluorescent",16.9
3246,OFF-EN-10002850,Office Supplies,Envelopes,"Ames Manila Envelope, Recycled",23.49
3247,OFF-AR-10000034,Office Supplies,Art,"BIC Brite Liner Grip Highlighters, Assorted, 5/Pack",4.24
3248,OFF-BI-10001267,Office Supplies,Binders,"Universal Recycled Hanging Pressboard Report Binders, Letter Size",6.17
3249,TEC-CO-10002617,Technology,Copiers,"Brother Fax Machine, High-Speed",211.16
3250,FUR-CH-10002932,Furniture,Chairs,"Harbour Creations Rocking Chair, Adjustable",149.58
3251,OFF-BI-10001199,Office Supplies,Binders,"Acco Index Tab, Durable",5.96
3254,FUR-BO-10004080,Furniture,Bookcases,"Ikea Stackable Bookrack, Traditional",122.58
3256,FUR-CH-10000745,Furniture,Chairs,"Hon Chairmat, Adjustable",58.02
3257,OFF-PA-10000450,Office Supplies,Paper,"Green Bar Note Cards, Multicolor",33.93
3259,FUR-FU-10000010,Furniture,Furnishings,"DAX Value U-Channel Document Frames, Easel Back",4.97
3260,OFF-BI-10000081,Office Supplies,Binders,"Ibico Index Tab, Clear",8.37
3261,OFF-FEL-10001792,Office Supplies,Storage,"Fellowes Folders, Wire Frame",25.47
3263,OFF-AVE-10000065,Office Supplies,Labels,"Avery Removable Labels, Alphabetical",10.56
3264,OFF-KLE-10001317,Office Supplies,Supplies,"Kleencut Ruler, Easy Grip",15.18
3266,OFF-FEL-10003848,Office Supplies,Storage,"Fellowes Trays, Industrial",57.87
3268,FUR-SAF-10001136,Furniture,Chairs,"SAFCO Swivel Stool, Adjustable",170.43
3270,FUR-FU-10002298,Furniture,Furnishings,"Rubbermaid ClusterMat Chairmats, Mat Size- 66"" x 60"", Lip 20"" x 11"" -90 Degree Angle",110.98
3271,OFF-SME-10000520,Office Supplies,Storage,"Smead Shelving, Wire Frame",48.0
3273,OFF-EAT-10002789,Office Supplies,Paper,"Eaton Computer Printout Paper, Recycled",26.46
3274,OFF-FEL-10004117,Office Supplies,Storage,"Fellowes Trays, Blue",57.39
3275,OFF-ST-10002583,Office Supplies,Storage,Fellowes Neat Ideas Storage Cubes,32.48
3276,OFF-BI-10004654,Office Supplies,Binders,VariCap6 Expandable Binder,17.3
3278,OFF-LA-10004853,Office Supplies,Labels,Avery 483,4.98
3279,OFF-BI-10004440,Office Supplies,Binders,"Cardinal Binder, Economy",13.83
3280,OFF-BI-10004728,Office Supplies,Binders,Wilson Jones Turn Tabs Binder Tool for Ring Binders,4.82
3282,OFF-ST-10002706,Office Supplies,Storage,"Fellowes File Cart, Wire Frame",136.38
3283,TEC-AC-10004054,Technology,Accessories,"Memorex Keyboard, Bluetooth",71.34
3284,OFF-AR-10003457,Office Supplies,Art,"Sanford Sketch Pad, Water Color",48.66
3285,OFF-PA-10004573,Office Supplies,Paper,"Enermax Memo Slips, Premium",15.66
3286,OFF-EN-10002104,Office Supplies,Envelopes,"Cameo Mailers, with clear poly window",41.7
3287,OFF-AR-10003766,Office Supplies,Art,"BIC Sketch Pad, Easy-Erase",32.62
3289,OFF-ST-10003154,Office Supplies,Storage,"Fellowes Shelving, Industrial",58.32
3290,FUR-BO-10002390,Furniture,Bookcases,"Ikea Library with Doors, Metal",362.85
3292,FUR-BO-10001337,Furniture,Bookcases,O'Sullivan Living Dimensions 2-Shelf Bookcases,120.98
3293,TEC-PH-10000810,Technology,Phones,"Nokia Headset, VoIP",73.2
3294,OFF-EN-10004793,Office Supplies,Envelopes,"Ames Interoffice Envelope, Security-Tint",31.68
3296,TEC-PH-10000576,Technology,Phones,AT&T 1080 Corded phone,136.99
3298,OFF-AR-10002987,Office Supplies,Art,Prismacolor Color Pencil Set,19.84
3300,OFF-BI-10001002,Office Supplies,Binders,"Avery Binder Covers, Recycled",7.62
3302,TEC-AC-10002712,Technology,Accessories,"Enermax Keyboard, Erganomic",54.18
3304,OFF-PA-10000289,Office Supplies,Paper,Xerox 213,6.48
3305,OFF-BI-10001430,Office Supplies,Binders,"Cardinal Index Tab, Clear",4.48
3306,OFF-BI-10002764,Office Supplies,Binders,Recycled Pressboard Report Cover with Reinforced Top Hinge,3.23
3307,FUR-TA-10003527,Furniture,Tables,"Chromcraft Wood Table, with Bottom Storage",482.52
3309,FUR-TA-10002228,Furniture,Tables,"Bevis Traditional Conference Table Top, Plinth Base",333.36
3310,FUR-BO-10004399,Furniture,Bookcases,"Bush Floating Shelf Set, Pine",172.62
3312,TEC-MA-10004533,Technology,Machines,"Konica Receipt Printer, Durable",122.37
3313,FUR-TA-10003222,Furniture,Tables,"Barricks Wood Table, with Bottom Storage",516.93
3314,FUR-NOV-10002453,Furniture,Chairs,"Novimex Rocking Chair, Black",129.0
3315,TEC-MOT-10003366,Technology,Phones,"Motorola Audio Dock, Full Size",174.66
3318,FUR-FU-10004820,Furniture,Furnishings,"Advantus Photo Frame, Erganomic",51.6
3320,OFF-BOS-10002472,Office Supplies,Art,"Boston Sketch Pad, Blue",48.6
3322,OFF-SU-10004643,Office Supplies,Supplies,"Elite Trimmer, Easy Grip",28.86
3324,OFF-EN-10004503,Office Supplies,Envelopes,"GlobeWeis Peel and Seal, Security-Tint",23.79
3325,OFF-FA-10001304,Office Supplies,Fasteners,"Stockwell Push Pins, Assorted Sizes",11.43
3326,OFF-EN-10002806,Office Supplies,Envelopes,"GlobeWeis Peel and Seal, Recycled",20.19
3327,OFF-PA-10000522,Office Supplies,Paper,"Xerox Computer Printout Paper, Recycled",26.25
3328,OFF-SAN-10001237,Office Supplies,Paper,"SanDisk Cards & Envelopes, Premium",48.42
3329,OFF-SAN-10001345,Office Supplies,Art,"Sanford Canvas, Water Color",53.7
3330,OFF-JIF-10003115,Office Supplies,Envelopes,"Jiffy Interoffice Envelope, Recycled",45.24
3331,OFF-ROG-10001549,Office Supplies,Storage,"Rogers Shelving, Blue",62.13
3332,FUR-FU-10003608,Furniture,Furnishings,"Advantus Light Bulb, Black",13.38
3333,FUR-FU-10000944,Furniture,Furnishings,"Advantus Light Bulb, Black",13.38
3335,FUR-TA-10004575,Furniture,Tables,Hon 5100 Series Wood Tables,290.98
3338,TEC-PH-10000439,Technology,Phones,GE DSL Phone Line Filter,39.99
3339,TEC-AC-10000540,Technology,Accessories,"Memorex Numeric Keypad, USB",43.02
3340,FUR-CH-10002126,Furniture,Chairs,Hon Deluxe Fabric Upholstered Stacking Chairs,243.98
3341,OFF-ST-10004549,Office Supplies,Storage,"Smead File Cart, Blue",84.98
3342,OFF-BI-10002511,Office Supplies,Binders,"Avery 3-Hole Punch, Clear",27.33
3343,OFF-AR-10001195,Office Supplies,Art,"Stanley Canvas, Water Color",52.65
3344,OFF-AR-10003096,Office Supplies,Art,"Binney & Smith Sketch Pad, Blue",30.88
3346,OFF-PA-10001526,Office Supplies,Paper,Xerox 1949,4.98
3347,OFF-ST-10004317,Office Supplies,Storage,"Smead Folders, Blue",17.49
3348,FUR-CH-10001797,Furniture,Chairs,"Safco Chair Connectors, 6/Carton",38.48
3349,FUR-OFF-10000344,Furniture,Chairs,"Office Star Bag Chairs, Adjustable",57.93
3350,OFF-SU-10004480,Office Supplies,Supplies,"Fiskars Box Cutter, Serrated",21.48
3351,FUR-FU-10000287,Furniture,Furnishings,"Eldon Stacking Tray, Black",31.5
3352,OFF-ACC-10002772,Office Supplies,Binders,"Acco Index Tab, Economy",10.08
3353,TEC-AC-10000397,Technology,Accessories,"Enermax Mouse, USB",40.5
3354,FUR-FU-10001933,Furniture,Furnishings,"Deflect-O Door Stop, Duo Pack",44.01
3355,OFF-AR-10003158,Office Supplies,Art,Fluorescent Highlighters by Dixon,3.98
3356,TEC-AC-10002857,Technology,Accessories,"Verbatim 25 GB 6x Blu-ray Single Layer Recordable Disc, 1/Pack",7.45
3358,OFF-AR-10003113,Office Supplies,Art,"Binney & Smith Pens, Blue",11.94
3360,OFF-BI-10003094,Office Supplies,Binders,Self-Adhesive Ring Binder Labels,3.52
3361,OFF-NOV-10004048,Office Supplies,Labels,"Novimex Legal Exhibit Labels, 5000 Label Set",10.86
3363,TEC-CO-10000666,Technology,Copiers,"Hewlett Copy Machine, Laser",263.31
3365,TEC-PH-10003691,Technology,Phones,BlackBerry Q10,125.99
3366,TEC-MA-10002931,Technology,Machines,"Konica Receipt Printer, Red",119.4
3368,TEC-AC-10000284,Technology,Accessories,"Belkin Flash Drive, Bluetooth",41.94
3369,OFF-GRE-10004604,Office Supplies,Paper,"Green Bar Cards & Envelopes, 8.5 x 11",52.53
3370,TEC-PH-10002154,Technology,Phones,"Cisco Headset, Full Size",89.73
3372,TEC-PH-10001921,Technology,Phones,"Nokia Signal Booster, with Caller ID",136.5
3373,OFF-BI-10002854,Office Supplies,Binders,"Performers Binder/Pad Holder, Black",28.03
3374,OFF-AP-10002403,Office Supplies,Appliances,Acco Smartsocket Color-Coded Six-Outlet AC Adapter Model Surge Protectors,44.01
3375,OFF-AR-10001002,Office Supplies,Art,"BIC Sketch Pad, Fluorescent",49.92
3376,OFF-PA-10002966,Office Supplies,Paper,"SanDisk Cards & Envelopes, Recycled",32.22
3379,OFF-AR-10002116,Office Supplies,Art,"BIC Pens, Fluorescent",15.54
3382,OFF-GRE-10004796,Office Supplies,Paper,"Green Bar Computer Printout Paper, Multicolor",31.17
3384,FUR-BO-10004914,Furniture,Bookcases,"Bush 3-Shelf Cabinet, Traditional",143.37
3385,OFF-KLE-10001699,Office Supplies,Supplies,"Kleencut Letter Opener, Easy Grip",28.68
3387,FUR-FU-10002525,Furniture,Furnishings,"Deflect-O Door Stop, Erganomic",42.57
3388,OFF-KLE-10000050,Office Supplies,Supplies,"Kleencut Trimmer, High Speed",41.43
3390,OFF-ST-10004550,Office Supplies,Storage,"Fellowes Folders, Wire Frame",25.47
3392,OFF-AR-10004344,Office Supplies,Art,Bulldog Vacuum Base Pencil Sharpener,11.99
3393,OFF-STO-10004363,Office Supplies,Fasteners,"Stockwell Paper Clips, Bulk Pack",13.62
