,Product ID,Category,Sub-Category,Product Name,Unit Price
8032,OFF-PA-10002921,Office Supplies,Paper,"Eaton Message Books, Multicolor",21.99
8033,OFF-ST-10002371,Office Supplies,Storage,"Rogers File Cart, Industrial",94.4
8036,FUR-CH-10000391,Furniture,Chairs,"Novimex Bag Chairs, Red",45.96
8037,FUR-HAR-10001089,Furniture,Chairs,"Harbour Creations Rocking Chair, Black",144.66
8039,OFF-BI-10004654,Office Supplies,Binders,"Ibico 3-Hole Punch, Economy",20.3
8041,FUR-CH-10001114,Furniture,Chairs,"Hon Chairmat, Set of Two",38.52
8044,OFF-AR-10000054,Office Supplies,Art,"Sanford Pencil Sharpener, Water Color",26.1
8045,TEC-HP -10002095,Technology,Copiers,"HP Copy Machine, Color",245.13
8047,OFF-LA-10000767,Office Supplies,Labels,"Hon Legal Exhibit Labels, Laser Printer Compatible",10.86
8049,OFF-KRA-10000113,Office Supplies,Envelopes,"Kraft Peel and Seal, Recycled",19.29
8054,FUR-OFF-10000303,Furniture,Chairs,"Office Star Rocking Chair, Set of Two",143.16
8055,OFF-BRE-10001378,Office Supplies,Appliances,"Breville Toaster, White",74.85
8056,OFF-GLO-10003639,Office Supplies,Envelopes,"GlobeWeis Interoffice Envelope, Security-Tint",50.22
8059,OFF-ST-10001580,Office Supplies,Storage,Super Decoflex Portable Personal File,14.98
8063,TEC-PAN-10003688,Technology,Machines,"Panasonic Printer, Wireless",266.49
8065,FUR-OFF-10002330,Furniture,Chairs,"Office Star Executive Leather Armchair, Black",467.43
8066,FUR-BO-10003034,Furniture,Bookcases,"O'Sullivan Elevations Bookcase, Cherry Finish",130.98
8070,TEC-MA-10001187,Technology,Machines,"Okidata Calculator, Wireless",34.86
8073,OFF-ST-10004116,Office Supplies,Storage,"Fellowes Shelving, Blue",38.56
8075,OFF-SAN-10004288,Office Supplies,Art,"Sanford Sketch Pad, Blue",45.48
8076,OFF-PA-10000382,Office Supplies,Paper,"SanDisk Computer Printout Paper, Multicolor",31.2
8079,OFF-STO-10000924,Office Supplies,Fasteners,"Stockwell Rubber Bands, Metal",16.65
8080,OFF-WIL-10000979,Office Supplies,Binders,"Wilson Jones Hole Reinforcements, Recycled",4.89
8083,OFF-LA-10002364,Office Supplies,Labels,"Smead Shipping Labels, Alphabetical",11.43
8085,OFF-EN-10004775,Office Supplies,Envelopes,"Kraft Manila Envelope, Set of 50",26.49
8087,TEC-EPS-10001341,Technology,Machines,"Epson Calculator, White",44.82
8089,OFF-BI-10000343,Office Supplies,Binders,"Pressboard Covers with Storage Hooks, 9 1/2"" x 11"", Light Blue",4.91
8090,TEC-CAN-10001437,Technology,Copiers,"Canon Wireless Fax, Laser",378.66
8098,TEC-CO-10002150,Technology,Copiers,"Canon Fax and Copier, Digital",190.98
8101,FUR-BO-10001003,Furniture,Bookcases,"Dania 3-Shelf Cabinet, Traditional",141.45
8102,OFF-HAM-10001302,Office Supplies,Appliances,"Hamilton Beach Microwave, White",280.65
8104,TEC-AC-10001616,Technology,Accessories,"SanDisk Numeric Keypad, Erganomic",56.85
8106,TEC-AC-10004848,Technology,Accessories,"SanDisk Memory Card, Erganomic",110.22
8108,OFF-AP-10001847,Office Supplies,Appliances,"Breville Toaster, Red",76.71
8110,FUR-BO-10001749,Furniture,Bookcases,"Bush Classic Bookcase, Traditional",412.68
8114,TEC-MA-10004603,Technology,Machines,"Okidata Printer, Durable",268.62
8117,OFF-AR-10001208,Office Supplies,Art,"Binney & Smith Canvas, Water Color",54.54
8118,OFF-AR-10003633,Office Supplies,Art,"Binney & Smith Canvas, Easy-Erase",51.63
8119,OFF-ST-10001954,Office Supplies,Storage,"Rogers Shelving, Wire Frame",40.8
8120,TEC-APP-10001108,Technology,Phones,"Apple Headset, with Caller ID",73.26
8125,OFF-PA-10000108,Office Supplies,Paper,"Green Bar Parchment Paper, 8.5 x 11",13.88
8126,OFF-PA-10000915,Office Supplies,Paper,"Eaton Note Cards, 8.5 x 11",17.66
8132,FUR-FU-10000641,Furniture,Furnishings,"Deflect-O Door Stop, Durable",27.32
8133,OFF-EN-10000352,Office Supplies,Envelopes,"GlobeWeis Peel and Seal, Recycled",20.19
8136,OFF-ELI-10004597,Office Supplies,Supplies,"Elite Box Cutter, Steel",34.29
8143,OFF-PA-10003499,Office Supplies,Paper,"Xerox Parchment Paper, 8.5 x 11",17.4
8148,OFF-BI-10002792,Office Supplies,Binders,"Ibico Index Tab, Durable",9.27
8150,OFF-ST-10001229,Office Supplies,Storage,"Fellowes Box, Single Width",19.71
8153,OFF-SU-10002521,Office Supplies,Supplies,"Kleencut Box Cutter, Steel",22.7
8154,OFF-FA-10004781,Office Supplies,Fasteners,"Stockwell Thumb Tacks, Metal",8.84
8155,OFF-PA-10003037,Office Supplies,Paper,"Eaton Memo Slips, Multicolor",15.15
8156,OFF-SU-10003665,Office Supplies,Supplies,"Stiletto Letter Opener, Steel",16.72
8157,OFF-AR-10000513,Office Supplies,Art,"BIC Pencil Sharpener, Easy-Erase",29.28
8158,OFF-SU-10001218,Office Supplies,Supplies,Fiskars Softgrip Scissors,10.98
8165,OFF-AR-10004269,Office Supplies,Art,Newell 31,4.13
8171,OFF-EN-10002891,Office Supplies,Envelopes,"GlobeWeis Mailers, with clear poly window",42.09
8173,OFF-PA-10000380,Office Supplies,Paper,"REDIFORM Incoming/Outgoing Call Register, 11"" X 8 1/2"", 100 Messages",8.34
8177,TEC-MOT-10002560,Technology,Phones,"Motorola Signal Booster, Full Size",144.42
8178,FUR-BO-10001324,Furniture,Bookcases,"Sauder Floating Shelf Set, Pine",195.93
8180,OFF-AP-10001099,Office Supplies,Appliances,"Hoover Stove, Black",567.9
8181,TEC-PH-10004559,Technology,Phones,"Nokia Speaker Phone, with Caller ID",123.15
8186,TEC-PH-10000455,Technology,Phones,GE 30522EE2,115.99
8187,TEC-PH-10002695,Technology,Phones,"Samsung Headset, with Caller ID",73.2
8188,OFF-PA-10001536,Office Supplies,Paper,"SanDisk Message Books, 8.5 x 11",27.96
8189,TEC-APP-10001732,Technology,Phones,"Apple Headset, Cordless",76.11
8190,FUR-BO-10004709,Furniture,Bookcases,"Bush Westfield Collection Bookcases, Medium Cherry Finish",57.98
8191,FUR-FU-10001977,Furniture,Furnishings,"Deflect-O Frame, Erganomic",108.66
8195,OFF-ST-10002659,Office Supplies,Storage,"Smead Shelving, Wire Frame",48.0
8199,OFF-PA-10004359,Office Supplies,Paper,"Xerox Computer Printout Paper, Premium",17.56
8201,TEC-AC-10004904,Technology,Accessories,"Enermax Mouse, Erganomic",38.1
8202,OFF-BI-10003768,Office Supplies,Binders,"Acco Index Tab, Clear",8.04
8203,OFF-BI-10000517,Office Supplies,Binders,"Acco Binder, Durable",11.1
8204,OFF-ACC-10001993,Office Supplies,Binders,"Acco Binder Covers, Clear",12.78
8207,FUR-NOV-10004602,Furniture,Chairs,"Novimex Executive Leather Armchair, Red",460.2
8209,TEC-MA-10001127,Technology,Machines,"HP Designjet T520 Inkjet Large Format Printer - 24"" Color",1749.99
8210,OFF-SU-10002544,Office Supplies,Supplies,"Kleencut Box Cutter, Serrated",31.35
8212,FUR-FU-10003601,Furniture,Furnishings,"Deflect-o RollaMat Studded, Beveled Mat for Medium Pile Carpeting",92.23
8213,OFF-IBI-10002637,Office Supplies,Binders,"Ibico Binding Machine, Durable",52.92
8215,OFF-EN-10000454,Office Supplies,Envelopes,"GlobeWeis Business Envelopes, Set of 50",17.34
8219,OFF-STI-10002519,Office Supplies,Supplies,"Stiletto Trimmer, High Speed",42.75
8220,OFF-EN-10003933,Office Supplies,Envelopes,"Kraft Manila Envelope, Security-Tint",28.89
8221,OFF-LA-10003278,Office Supplies,Labels,"Novimex Shipping Labels, 5000 Label Set",11.37
8223,OFF-ACC-10004430,Office Supplies,Fasteners,"Accos Rubber Bands, 12 Pack",16.11
8225,TEC-MA-10003979,Technology,Machines,Ativa V4110MDD Micro-Cut Shredder,699.99
8231,TEC-PH-10003535,Technology,Phones,RCA ViSYS 25423RE1 Corded phone,99.99
8235,OFF-ACM-10003591,Office Supplies,Supplies,"Acme Trimmer, Steel",43.98
8236,OFF-EN-10001375,Office Supplies,Envelopes,"GlobeWeis Mailers, with clear poly window",28.06
8241,FUR-BO-10002926,Furniture,Bookcases,"Bush Stackable Bookrack, Mobile",123.51
8256,OFF-AP-10003590,Office Supplies,Appliances,"KitchenAid Refrigerator, Black",527.37
8258,TEC-SAM-10000345,Technology,Phones,"Samsung Audio Dock, with Caller ID",166.83
8260,OFF-AR-10002956,Office Supplies,Art,Boston 16801 Nautilus Battery Pencil Sharpener,22.01
8261,OFF-LA-10004034,Office Supplies,Labels,"Harbour Creations Color Coded Labels, Alphabetical",8.48
8263,TEC-PH-10002365,Technology,Phones,Belkin Grip Candy Sheer Case / Cover for iPhone 5 and 5S,8.78
8264,OFF-FA-10003112,Office Supplies,Fasteners,Staples,7.89
8266,OFF-LA-10001297,Office Supplies,Labels,Avery 473,10.35
8269,OFF-SU-10000946,Office Supplies,Supplies,Staples,7.98
8270,OFF-AP-10002350,Office Supplies,Appliances,Belkin F9H710-06 7 Outlet SurgeMaster Surge Protector,18.84
8274,OFF-AR-10004974,Office Supplies,Art,Newell 342,3.28
8278,OFF-FA-10001577,Office Supplies,Fasteners,"Stockwell Staples, Bulk Pack",10.8
8280,TEC-PH-10000148,Technology,Phones,Cyber Acoustics AC-202b Speech Recognition Stereo Headset,12.99
8281,FUR-FU-10003274,Furniture,Furnishings,Regeneration Desk Collection,1.76
8285,OFF-SU-10003632,Office Supplies,Supplies,"Acme Letter Opener, Easy Grip",31.83
8287,OFF-PA-10001497,Office Supplies,Paper,Xerox 1914,54.96
8290,OFF-ST-10003810,Office Supplies,Storage,"Tenex Box, Single Width",16.53
8291,TEC-APP-10002829,Technology,Phones,"Apple Audio Dock, Full Size",168.18
8292,TEC-AC-10002324,Technology,Accessories,"Enermax Numeric Keypad, Bluetooth",57.33
8293,TEC-PH-10001428,Technology,Phones,"Motorola Headset, VoIP",79.83
8294,TEC-AC-10003951,Technology,Accessories,"Belkin Mouse, Bluetooth",40.71
8295,OFF-ST-10001366,Office Supplies,Storage,"Rogers Folders, Wire Frame",29.76
8296,OFF-PA-10000476,Office Supplies,Paper,"Eaton Computer Printout Paper, Premium",26.55
8298,OFF-PA-10003936,Office Supplies,Paper,Xerox 1994,6.48
8299,FUR-FU-10002818,Furniture,Furnishings,"Advantus Stacking Tray, Black",17.62
8302,TEC-PH-10004450,Technology,Phones,"Cisco Office Telephone, Full Size",81.75
8303,TEC-CO-10000405,Technology,Copiers,"Canon Fax Machine, Digital",318.03
8304,OFF-ST-10003111,Office Supplies,Storage,"Eldon Trays, Single Width",48.0
8306,OFF-AR-10002575,Office Supplies,Art,"Sanford Canvas, Blue",50.52
8310,OFF-EN-10000890,Office Supplies,Envelopes,"Ames Peel and Seal, Recycled",17.49
8311,OFF-FIS-10004155,Office Supplies,Supplies,"Fiskars Letter Opener, Steel",24.63
8313,OFF-LA-10002486,Office Supplies,Labels,"Novimex File Folder Labels, 5000 Label Set",8.64
8317,TEC-CO-10003964,Technology,Copiers,"Canon Fax Machine, High-Speed",211.06
8319,TEC-SAM-10001131,Technology,Phones,"Samsung Smart Phone, VoIP",636.24
8320,TEC-PH-10002320,Technology,Phones,"Samsung Speaker Phone, Full Size",124.53
8321,OFF-ST-10001010,Office Supplies,Storage,"Fellowes Lockers, Industrial",138.54
8322,TEC-PH-10001805,Technology,Phones,"Nokia Speaker Phone, Full Size",124.44
8323,TEC-AC-10004571,Technology,Accessories,"Logitech Router, Programmable",248.82
8324,OFF-ST-10003785,Office Supplies,Storage,"Eldon Lockers, Blue",197.91
8326,TEC-PH-10004505,Technology,Phones,"Nokia Smart Phone, Full Size",637.35
8329,OFF-ST-10002105,Office Supplies,Storage,"Smead Trays, Wire Frame",31.7
8330,OFF-PA-10001950,Office Supplies,Paper,Southworth 25% Cotton Antique Laid Paper & Envelopes,8.34
8334,TEC-OKI-10000616,Technology,Machines,"Okidata Card Printer, Durable",175.95
8335,OFF-GRE-10001774,Office Supplies,Paper,"Green Bar Note Cards, Premium",29.79
8337,OFF-FA-10004239,Office Supplies,Fasteners,"Advantus Staples, Metal",10.98
8338,OFF-AP-10003043,Office Supplies,Appliances,"Breville Blender, White",60.66
8339,OFF-LA-10001474,Office Supplies,Labels,Avery 477,30.53
8343,OFF-BI-10003364,Office Supplies,Binders,Binding Machine Supplies,29.17
8344,FUR-FU-10001692,Furniture,Furnishings,"Eldon Clock, Duo Pack",37.72
8345,TEC-AC-10001635,Technology,Accessories,KeyTronic†KT400U2 -†Keyboard†- Black,10.28
8346,OFF-CAR-10004886,Office Supplies,Binders,"Cardinal Binder, Economy",13.83
8350,FUR-CH-10003077,Furniture,Chairs,"SAFCO Bag Chairs, Adjustable",34.62
8352,OFF-STO-10002661,Office Supplies,Fasteners,"Stockwell Staples, 12 Pack",9.84
8356,OFF-STO-10004496,Office Supplies,Fasteners,"Stockwell Push Pins, Bulk Pack",13.98
8358,TEC-EPS-10000053,Technology,Machines,"Epson Receipt Printer, Red",114.18
8361,TEC-PH-10002885,Technology,Phones,Apple iPhone 5,649.83
8362,TEC-AC-10002884,Technology,Accessories,"Belkin Keyboard, USB",84.09
8363,TEC-BEL-10001689,Technology,Accessories,"Belkin Router, Programmable",260.25
8365,TEC-MA-10003558,Technology,Machines,"Panasonic Calculator, Durable",50.4
8369,TEC-AC-10003047,Technology,Accessories,"SanDisk Keyboard, USB",54.46
8370,TEC-AC-10000097,Technology,Accessories,"Belkin Mouse, Programmable",28.14
8372,FUR-FU-10000242,Furniture,Furnishings,"Deflect-O Frame, Durable",71.38
8373,OFF-SAN-10003687,Office Supplies,Art,"Sanford Sketch Pad, Easy-Erase",45.75
8376,FUR-FU-10004139,Furniture,Furnishings,"Tenex Photo Frame, Duo Pack",34.6
8377,FUR-FU-10001770,Furniture,Furnishings,"Deflect-O Clock, Erganomic",48.93
8378,TEC-PH-10003513,Technology,Phones,"Nokia Speaker Phone, VoIP",123.24
8379,TEC-LOG-10003254,Technology,Accessories,"Logitech Keyboard, Programmable",73.95
8381,OFF-PA-10000540,Office Supplies,Paper,"Enermax Note Cards, Multicolor",21.76
8382,FUR-TEN-10001349,Furniture,Furnishings,"Tenex Frame, Black",109.98
8384,OFF-EN-10003619,Office Supplies,Envelopes,"Kraft Manila Envelope, with clear poly window",30.03
8396,FUR-FU-10004864,Furniture,Furnishings,Eldon 500 Class Desk Accessories,12.07
8399,OFF-PA-10000249,Office Supplies,Paper,Staples,12.28
8401,OFF-FA-10002388,Office Supplies,Fasteners,"Accos Push Pins, Assorted Sizes",11.97
8403,OFF-AR-10004132,Office Supplies,Art,"Boston Pens, Blue",9.48
8404,OFF-EN-10000315,Office Supplies,Envelopes,"Kraft Manila Envelope, Recycled",16.86
8405,OFF-EN-10000726,Office Supplies,Envelopes,"Jiffy Clasp Envelope, Set of 50",8.52
8410,OFF-BI-10004995,Office Supplies,Binders,GBC DocuBind P400 Electric Binding System,1360.99
8411,OFF-ST-10002900,Office Supplies,Storage,"Smead Lockers, Wire Frame",197.49
8412,FUR-BO-10001875,Furniture,Bookcases,"Bush Library with Doors, Mobile",366.84
8413,TEC-CO-10002872,Technology,Copiers,"Canon Ink, Color",148.59
8415,FUR-SAF-10000607,Furniture,Bookcases,"Safco Stackable Bookrack, Mobile",148.98
8417,OFF-AP-10002573,Office Supplies,Appliances,"Hamilton Beach Stove, Black",541.77
8418,FUR-DAN-10002314,Furniture,Bookcases,"Dania Stackable Bookrack, Traditional",121.05
8424,OFF-AP-10002457,Office Supplies,Appliances,"Eureka The Boss Plus 12-Amp Hard Box Upright Vacuum, Red",104.65
8426,OFF-KLE-10002292,Office Supplies,Supplies,"Kleencut Scissors, Steel",21.69
8427,TEC-PH-10003430,Technology,Phones,"Cisco Speaker Phone, VoIP",138.57
8434,OFF-LA-10000984,Office Supplies,Labels,"Hon Round Labels, Alphabetical",6.48
8435,FUR-FU-10001129,Furniture,Furnishings,"Deflect-O Stacking Tray, Black",25.35
8437,OFF-BIN-10002407,Office Supplies,Art,"Binney & Smith Highlighters, Water Color",19.77
8439,OFF-PA-10003939,Office Supplies,Paper,"Enermax Note Cards, Multicolor",21.76
8441,OFF-SU-10001074,Office Supplies,Supplies,"Fiskars Letter Opener, Easy Grip",27.93
8442,OFF-ST-10002074,Office Supplies,Storage,"Tenex Box, Blue",16.5
8443,OFF-FA-10001574,Office Supplies,Fasteners,"Accos Clamps, Bulk Pack",19.38
8444,OFF-EN-10003838,Office Supplies,Envelopes,"Cameo Business Envelopes, Security-Tint",16.95
8447,OFF-CUI-10002413,Office Supplies,Appliances,"Cuisinart Coffee Grinder, Black",38.04
8452,OFF-PA-10004675,Office Supplies,Paper,"Telephone Message Books with Fax/Mobile Section, 5 1/2"" x 3 3/16""",6.35
8454,TEC-PH-10002293,Technology,Phones,Anker 36W 4-Port USB Wall Charger Travel Power Adapter for iPhone 5s 5c 5,19.99
8457,OFF-BIC-10001632,Office Supplies,Art,"BIC Pens, Easy-Erase",14.55
8459,OFF-AR-10004999,Office Supplies,Art,Newell 315,5.98
8463,OFF-FA-10002780,Office Supplies,Fasteners,Staples,2.98
8464,TEC-AC-10000290,Technology,Accessories,Sabrent 4-Port USB 2.0 Hub,6.79
8465,OFF-BI-10003188,Office Supplies,Binders,"Wilson Jones Binder Covers, Economy",11.19
8472,OFF-AP-10000691,Office Supplies,Appliances,"Cuisinart Refrigerator, Red",496.08
8473,FUR-CH-10002410,Furniture,Chairs,"Office Star Rocking Chair, Red",140.91
8475,FUR-BO-10002968,Furniture,Bookcases,"Bush Library with Doors, Metal",242.52
8476,OFF-EN-10002752,Office Supplies,Envelopes,"Jiffy Peel and Seal, Set of 50",20.01
8479,FUR-BO-10000734,Furniture,Bookcases,"Bush Corner Shelving, Pine",83.56
8480,FUR-CH-10003514,Furniture,Chairs,"Harbour Creations Rocking Chair, Set of Two",99.56
8484,TEC-PH-10002574,Technology,Phones,"Cisco Speaker Phone, Cordless",94.22
8485,FUR-CH-10000608,Furniture,Chairs,"Office Star Chairmat, Set of Two",68.07
8486,OFF-PA-10000588,Office Supplies,Paper,"SanDisk Cards & Envelopes, 8.5 x 11",52.56
8489,OFF-ST-10004183,Office Supplies,Storage,"Rogers Trays, Wire Frame",60.75
8490,FUR-FU-10003214,Furniture,Furnishings,"Eldon Stacking Tray, Durable",28.53
8491,TEC-AC-10003989,Technology,Accessories,"Enermax Numeric Keypad, Bluetooth",57.54
8493,OFF-AR-10003631,Office Supplies,Art,Staples,4.84
8495,OFF-AME-10000244,Office Supplies,Envelopes,"Ames Manila Envelope, Security-Tint",27.09
8498,OFF-AR-10000503,Office Supplies,Art,"Stanley Pens, Blue",6.7
8501,OFF-LA-10001215,Office Supplies,Labels,"Harbour Creations File Folder Labels, Laser Printer Compatible",8.73
8502,OFF-ST-10003172,Office Supplies,Storage,"Eldon Box, Wire Frame",6.22
8504,OFF-BI-10003588,Office Supplies,Binders,"Ibico Binder, Economy",15.48
8506,FUR-CH-10003836,Furniture,Chairs,"Harbour Creations Rocking Chair, Red",147.09
8507,TEC-SHA-10001309,Technology,Copiers,"Sharp Fax Machine, Digital",295.29
8510,OFF-ST-10004950,Office Supplies,Storage,"Tenex Personal Filing Tote With Secure Closure Lid, Black/Frost",15.51
8511,OFF-EN-10003547,Office Supplies,Envelopes,"Jiffy Interoffice Envelope, Set of 50",46.44
8514,OFF-LA-10000615,Office Supplies,Labels,"Hon Removable Labels, Adjustable",10.65
8515,FUR-CH-10001695,Furniture,Chairs,"Harbour Creations Chairmat, Set of Two",74.25
8518,TEC-PH-10004800,Technology,Phones,"Apple Headset, Full Size",74.55
8525,OFF-FA-10002791,Office Supplies,Fasteners,"OIC Push Pins, Assorted Sizes",12.36
8527,OFF-AP-10002552,Office Supplies,Appliances,"Hamilton Beach Stove, White",540.48
8532,TEC-MA-10000875,Technology,Machines,"Okidata Inkjet, Wireless",314.22
8533,OFF-ST-10002292,Office Supplies,Storage,"Sauder Facets Collection Locker/File Cabinet, Sky Alder Finish",370.98
8534,OFF-CUI-10003993,Office Supplies,Appliances,"Cuisinart Microwave, Red",278.46
8536,OFF-PA-10003510,Office Supplies,Paper,"Enermax Message Books, Recycled",22.41
8537,OFF-EN-10001449,Office Supplies,Envelopes,"Kraft Manila Envelope, with clear poly window",30.03
8538,OFF-EN-10000556,Office Supplies,Envelopes,"Kraft Interoffice Envelope, Security-Tint",49.32
8540,TEC-AC-10003753,Technology,Accessories,"SanDisk Router, Programmable",257.85
8545,TEC-PAN-10002690,Technology,Machines,"Panasonic Card Printer, Wireless",173.82
8549,TEC-PH-10000358,Technology,Phones,"Samsung Headset, with Caller ID",73.2
8551,FUR-FU-10003419,Furniture,Furnishings,"Eldon Clock, Erganomic",36.76
8553,OFF-BI-10004236,Office Supplies,Binders,"XtraLife ClearVue Slant-D Ring Binder, White, 3""",14.68
8554,OFF-XER-10003329,Office Supplies,Paper,"Xerox Computer Printout Paper, Multicolor",27.75
8559,OFF-AR-10000452,Office Supplies,Art,"Boston Pencil Sharpener, Fluorescent",28.95
8560,OFF-ROG-10003300,Office Supplies,Storage,"Rogers Box, Wire Frame",23.04
8561,OFF-AP-10003334,Office Supplies,Appliances,"Cuisinart Coffee Grinder, Silver",39.36
8563,OFF-PA-10004040,Office Supplies,Paper,Universal Premium White Copier/Laser Paper (20Lb. and 87 Bright),5.98
8565,OFF-CAM-10000192,Office Supplies,Envelopes,"Cameo Interoffice Envelope, with clear poly window",50.97
8566,FUR-FU-10000448,Furniture,Furnishings,Tenex Chairmats For Use With Carpeted Floors,15.98
8567,FUR-FU-10002045,Furniture,Furnishings,"Executive Impressions 14""",22.23
8568,OFF-PA-10004648,Office Supplies,Paper,"Xerox Message Books, Recycled",20.28
8571,OFF-EN-10004870,Office Supplies,Envelopes,"Jiffy Mailers, Security-Tint",26.38
8572,FUR-FU-10004998,Furniture,Furnishings,"Eldon Stacking Tray, Erganomic",20.08
8575,OFF-WIL-10003308,Office Supplies,Binders,"Wilson Jones Binder Covers, Recycled",11.55
8580,OFF-AVE-10004308,Office Supplies,Binders,"Avery Binder, Durable",14.4
8581,OFF-BI-10002975,Office Supplies,Binders,"Wilson Jones Index Tab, Clear",5.91
8584,OFF-SU-10004664,Office Supplies,Supplies,Acme Softgrip Scissors,8.14
8587,OFF-AP-10000486,Office Supplies,Appliances,"Cuisinart Stove, Silver",539.04
8588,FUR-TA-10000617,Furniture,Tables,"Hon Practical Foundations 30 x 60 Training Table, Light Gray/Charcoal",227.55
8589,TEC-HEW-10002501,Technology,Copiers,"Hewlett Fax Machine, Laser",319.92
8591,TEC-OKI-10001385,Technology,Machines,"Okidata Inkjet, White",311.25
8592,OFF-GRE-10001059,Office Supplies,Paper,"Green Bar Note Cards, 8.5 x 11",29.7
8598,FUR-CH-10000214,Furniture,Chairs,"Harbour Creations Bag Chairs, Black",59.19
8599,OFF-LA-10000134,Office Supplies,Labels,"Harbour Creations Removable Labels, 5000 Label Set",10.35
8600,TEC-PH-10003774,Technology,Phones,"Cisco Headset, with Caller ID",88.44
8601,OFF-LA-10002868,Office Supplies,Labels,"Hon Removable Labels, 5000 Label Set",6.84
8603,OFF-LA-10000157,Office Supplies,Labels,"Novimex Shipping Labels, Laser Printer Compatible",10.98
8610,TEC-AC-10002217,Technology,Accessories,Imation†Clip USB†flash drive†- 8 GB,18.8
8612,OFF-PA-10003868,Office Supplies,Paper,"SanDisk Cards & Envelopes, Recycled",48.33
8614,FUR-CH-10003282,Furniture,Chairs,"SAFCO Bag Chairs, Black",47.01
8615,FUR-FU-10000647,Furniture,Furnishings,"Tenex Door Stop, Erganomic",42.51
8617,OFF-LA-10002703,Office Supplies,Labels,"Novimex Removable Labels, Adjustable",10.26
8618,FUR-CH-10000847,Furniture,Chairs,Global Executive Mid-Back Manager's Chair,290.98
8619,TEC-CO-10000011,Technology,Copiers,"HP Personal Copier, High-Speed",122.49
8621,FUR-BO-10004371,Furniture,Bookcases,"Dania Classic Bookcase, Pine",274.74
8624,OFF-EN-10002410,Office Supplies,Envelopes,"GlobeWeis Manila Envelope, Recycled",26.19
8625,OFF-HAM-10003992,Office Supplies,Appliances,"Hamilton Beach Toaster, Silver",58.26
8627,TEC-HP -10002307,Technology,Copiers,"HP Fax and Copier, Laser",172.89
8628,FUR-FU-10004497,Furniture,Furnishings,"Tenex Door Stop, Erganomic",42.51
8630,OFF-BI-10000972,Office Supplies,Binders,"Acco 3-Hole Punch, Economy",30.12
8632,OFF-ST-10004330,Office Supplies,Storage,"Smead Folders, Single Width",11.68
8634,FUR-OFF-10003104,Furniture,Chairs,"Office Star Bag Chairs, Red",55.44
8635,OFF-BI-10001279,Office Supplies,Binders,"Wilson Jones 3-Hole Punch, Durable",19.66
8638,FUR-RUB-10003411,Furniture,Furnishings,"Rubbermaid Stacking Tray, Erganomic",22.17
8639,OFF-AP-10003834,Office Supplies,Appliances,"KitchenAid Stove, Red",380.1
8640,TEC-CO-10003448,Technology,Copiers,"Canon Ink, Laser",147.15
8642,OFF-KIT-10004058,Office Supplies,Appliances,"KitchenAid Stove, White",568.29
8643,TEC-MA-10004428,Technology,Machines,"Panasonic Card Printer, Durable",173.94
8646,TEC-MA-10003975,Technology,Machines,"Epson Phone, Wireless",80.97
8648,FUR-CH-10004609,Furniture,Chairs,"Harbour Creations Steel Folding Chair, Adjustable",100.38
8649,FUR-FU-10000526,Furniture,Furnishings,"Deflect-O Frame, Durable",107.07
8652,OFF-AP-10002239,Office Supplies,Appliances,"Hoover Toaster, White",81.78
8656,TEC-PH-10000931,Technology,Phones,"Motorola Speaker Phone, VoIP",86.58
8657,FUR-CH-10002304,Furniture,Chairs,"Global Stack Chair without Arms, Black",25.98
8660,OFF-AR-10003957,Office Supplies,Art,"Stanley Canvas, Fluorescent",50.73
8662,OFF-AP-10003363,Office Supplies,Appliances,"Hoover Blender, White",65.28
8663,OFF-PA-10004034,Office Supplies,Paper,"Green Bar Parchment Paper, 8.5 x 11",20.82
8664,OFF-PA-10002369,Office Supplies,Paper,"Eaton Parchment Paper, Multicolor",14.88
8665,OFF-AP-10004305,Office Supplies,Appliances,"Breville Blender, Silver",60.16
8666,OFF-BI-10004098,Office Supplies,Binders,"Acco 3-Hole Punch, Durable",31.62
8667,OFF-SU-10000782,Office Supplies,Supplies,"Fiskars Shears, Serrated",44.34
8669,TEC-PH-10001640,Technology,Phones,"Motorola Office Telephone, Full Size",73.05
8675,OFF-SU-10002909,Office Supplies,Supplies,"Fiskars Ruler, Easy Grip",16.05
8680,OFF-PA-10003832,Office Supplies,Paper,"Xerox Message Books, 8.5 x 11",16.34
8682,OFF-FA-10001476,Office Supplies,Fasteners,"OIC Paper Clips, Assorted Sizes",7.92
8687,OFF-LA-10002995,Office Supplies,Labels,"Avery Removable Labels, Adjustable",8.64
8689,OFF-FA-10002632,Office Supplies,Fasteners,"Accos Staples, Metal",7.38
8690,FUR-FU-10000732,Furniture,Furnishings,Eldon 200 Class Desk Accessories,6.28
8696,OFF-ST-10002957,Office Supplies,Storage,Sterilite Show Offs Storage Containers,5.28
8697,OFF-LA-10000973,Office Supplies,Labels,Avery 502,3.15
8698,OFF-PA-10003296,Office Supplies,Paper,"Xerox Message Books, Recycled",13.52
8699,OFF-AP-10004186,Office Supplies,Appliances,"Breville Refrigerator, Black",518.76
8700,TEC-CO-10001703,Technology,Copiers,"Brother Copy Machine, Laser",261.93
8701,FUR-BO-10000203,Furniture,Bookcases,"Sauder Library with Doors, Metal",387.09
8702,TEC-MA-10002918,Technology,Machines,"StarTech Card Printer, White",161.91
8703,OFF-AP-10003538,Office Supplies,Appliances,"Hamilton Beach Microwave, Silver",188.84
8708,OFF-AP-10003021,Office Supplies,Appliances,"Breville Stove, White",559.68
8713,OFF-EN-10002008,Office Supplies,Envelopes,"Cameo Mailers, Recycled",36.96
8715,OFF-STA-10001112,Office Supplies,Art,"Stanley Markers, Easy-Erase",22.47
8716,OFF-SU-10000556,Office Supplies,Supplies,"Kleencut Shears, Steel",30.78
8717,FUR-SAF-10002121,Furniture,Chairs,"SAFCO Rocking Chair, Black",132.48
8720,FUR-RUB-10001484,Furniture,Furnishings,"Rubbermaid Clock, Durable",47.19
8722,OFF-FA-10001045,Office Supplies,Fasteners,"Stockwell Staples, 12 Pack",9.84
8724,OFF-SU-10001682,Office Supplies,Supplies,"Kleencut Letter Opener, High Speed",17.64
8729,FUR-FU-10003370,Furniture,Furnishings,"Tenex Light Bulb, Durable",10.64
8730,FUR-FU-10002292,Furniture,Furnishings,"Deflect-O Door Stop, Duo Pack",44.01
8732,TEC-SAN-10002684,Technology,Accessories,"SanDisk Flash Drive, USB",39.75
8733,OFF-STI-10000286,Office Supplies,Supplies,"Stiletto Ruler, Steel",14.28
